{
  "schemaVersion": "1.0",
  "registryId": "synthetic-pricing-intake-demo-relationship-registry",
  "familyId": "synthetic-pricing-intake-demo",
  "generatedAt": "2026-07-22T00:00:00Z",
  "reviewOnly": true,
  "learnerFacingAllowed": false,
  "appReadyAllowed": false,
  "ragReadyAllowed": false,
  "promotionStatus": "not_promoted",
  "relationshipCount": 1,
  "relationships": [
    {
      "relationshipId": "relationship-synthetic-pricing-product-to-assumption-supports",
      "sourceId": "synthetic-pricing-intake-demo:synthetic-pricing-product-specification",
      "targetId": "synthetic-pricing-intake-demo:synthetic-pricing-assumption-memo",
      "sourceDocumentId": "synthetic-pricing-product-specification",
      "targetDocumentId": "synthetic-pricing-assumption-memo",
      "targetScope": "family",
      "relationType": "supports",
      "direction": "source_to_target",
      "relationshipStatus": "candidate",
      "origin": "intake_manifest",
      "reviewRequired": true,
      "promotionStatus": "not_promoted",
      "promotionEligible": false,
      "reviewDecision": "pending",
      "reviewer": null,
      "reviewDate": null,
      "reviewRationale": "",
      "finalRelationType": null,
      "finalConfidence": null,
      "confidence": 0.5,
      "evidenceStrength": "source_inventory_metadata",
      "generationRule": "synthetic-fixture-relationship-hint",
      "caveat": "Documentary relationship only; confirm during human review before downstream use.",
      "notes": "Synthetic relationship fixture; confirm before promotion.",
      "evidence": [
        {
          "sourcePath": "data/samples/contract-demo/document-family-intake.example.json",
          "notes": "Synthetic fixture metadata; not a real source citation."
        }
      ]
    }
  ],
  "notes": "Synthetic candidate relationship registry fixture."
}
